id,title,desc,loc,date,tags
16,Careers & Internships in U.S. Government Foreign Affairs,"Interested in a career formulating, representing, or implementing US foreign policy? This panel featuring UM's Diplomat-in-Residence, student interns and returned Peace Corps volunteers will talk about the foreign and civil service opportunities within the State Department and other federal agencies. Please note that US government agencies require U.S. citizenship. The deadline for summer internships is November 1.",Map Weill Hall - Room 1120,['2009-10-15 18:00']
17,Health in Africa: Working in Critical Conditions with Dr. Rick Hodes,"Dr. Rick Hodes, the legendary physician who has treated children in Ethiopia for almost 30 years, will speak Wednesday, February 10, 2010 from 5:00pm - 6:00pm at the University of Michigan School of Public Health. Dr. Hodes, known by some as ""Father Theresa,"" has been highlighted by CNN's ""Heroes"" program and will be featured in an HBO documentary to be released in April. The trailer for the film, ""Making the Crooked Straight,"" can be viewed on YouTube. Dr. Hodes, an active board member of ""Will Work for Food,"" will speak about his experiences ranging from the 1984 Ethiopian Famine to his current work at Mother Teresa's mission in Addis Ababa treating cancer, heart diseases and spinal conditions. Sponsored by: Will Work For Food, U-M Hillel, University of Michigan School of Public Health, the Center for Global Health, Global REACH, Ginsberg Center. Location: School of Public Health, 1415 Washington Heights, SPH I Crossroads 1690",Map Henry F. Vaughan School of Public Health Bldg I and Crossroads and Tower - SPH I Crossroads 1690,['2010-02-10 17:00']
18,Alternative Weekends Info Table,"Alternative Weekends will be giving out FREE t-shirts (Go Blue or Go Home) while sharing information about the organization in the Chemistry Atrium on Monday, 9/14, and in the Angell Hall Posting Wall on Tuesday, 9/15 from 10am-4pm. Make sure to stop by and check it out. Join Alternative Weekends! Alternative Weekends is a SERVE run program that provides opportunities for those who are interested and dedicated to community service and social action Volunteer one weekend a month. Work on a specific social issue! Make a difference in your world! LGBTQ Environment Homelessness Urban Poverty Urban Renewal Children with Disabilities EMAIL awsome@umich.edu WITH YOUR QUESTIONS SERVE is part of the Ginsberg Center in the Division of Student Affairs",Map Chemistry & Willard H Dow Laboratory,"['2009-09-14 10:00', '2009-09-15 10:00']"
21,"MYSTIC's Bronze Elegance ""L""The Show Fashion Charity Show","Bronze Elegance Multicultural Charity Fashion Show is an annual event hosted by Alice Lloyd Hall's multicultural council: MYSTIC. MYSTIC was established on campus to celebrate the beauty of minorities. As awareness has grown through the years, our goals have expanded to break stereotypes through creating a show in which both models and the students participating behind the scenes display the true diversity of the University of Michigan by representing different shapes, sizes, ethnicities, religions,and backgrounds. Our motto is: ""Charity: That's why we walk!""",Map Michigan Union - Rogel Ballroom,['2010-03-14 19:00']
22,"Guest Recital/ Masterclass:  Michele Stebelton, horn and Lisa Bontrager, horn","MirrorImage, horn duo featuring Michelle Stebleton and Lisa Bontrager with Tomoko Kamanaru, piano, will present works from their upcoming compact disc project, ""Safari."" The concert will include commissions for the ensemble by Paul Basler, Ray Chase, and Larry Lowe, in addition to opera arrangements by Ray Chase, which have been recorded for the ensemble's recent MSR Classics compact disc release, ""MirrorImage at the Opera.""",Map Earl V. Moore Building - Britton Recital Hall,['2009-11-09 16:30']
23,The People of the Books: Attitudes toward Writing among the Greeks and Romans,"While not the first people to have a written language, the Greeks developed a special attitude toward literature in general and then toward its physical manifestation in the form of books. Whether feared, revered, or ridiculed, soon after writing was developed, books were seen as objects to illustrate on vases and were even the topic of other books. This lecture will examine this complex attitude first among the Greeks and then its later development among the Romans.",Map Michigan League - Vandenberg Room,['2009-10-05 16:00']
24,John Freeman Reading,"John Freeman is the author of The Tyranny of E-Mail, and is an award-winning writer and book critic who has written for numerous publications, including The New York Times Book Review, the Los Angeles Times, The Guardian, and The Wall Street Journal. Freeman won the 2007 James Patterson PageTurner Award. He was recently named editor of Granta. He lives in New York City.",Map Angell Hall - 3222 Angell Hall,['2010-03-09 17:00']
25,"Masters Recital: Joon-ho Kim, violin","PROGRAM: Mozart - Violin Sonata in E Minor, K. 304; Bach - Sonata No. 3 in C Major, BWV 1005; Tchaikovsky - Melody Op. 42, No. 3; Rochberg - Caprice Variations; Wieniawski - Polonaise brillante in A Major, Op. 21",Map Walgreen Drama Center - Stamps Auditorium,['2010-03-18 17:00']
26,Opera Workshop,"Opera Workshop I presents an evening of arias and Shakespeare monologues. Joshua Major, director; Timothy Cheek, music director.",Map Earl V. Moore Building - McIntosh Theatre,['2009-12-03 19:30']
28,Amazin' Blue Winter Concert 2010,A Cappella Concert,Map Rackham Graduate School (Horace H.) - Auditorium,['2010-03-27 20:00']
29,A Day at the Museum,"Are you curious about what occurs behind the scenes in our U-M museum or about the people and skills it takes to make a museum work? Have you wondered what it would be like to have a job in a museum or about the kinds of training you need to pursue a museum career? This winter, please join us for a series of lectures and discussions featuring U-M's museum professionals. Presenters will include some of U-M's museum directors, curators, conservators, collection managers, registrars, exhibit designers and others, who will discuss and answer questions about how they became involved in museum work and describe their typical day at the museum.",Map Kelsey Museum of Archaeology - 124,['2010-03-25 14:30']
30,The Royal Shakespeare Company/U-M Creative Project,"The Bible as Literature: discussion with RSC director Greg Doran, playwright David Edgar, and Ralph Williams: A discussion of the translation of Biblical texts with RSC director Greg Doran, U-M professor Ralph Williams, and playwright David Edgar, who has written for the RSC a new play, Written on the Heart, based on Lancelot Andrewes's role in the translation of the King James Version of the Bible. Open to the public. NOTE: Papyrus fragment of the mid-second century to the King James (1611) Version of the Bible will be on display. The artifacts are from the University of Michigan Library's special collections.","Map Harlan Hatcher Graduate Library - The Library Gallery, 100 Hatcher",['2010-03-27 16:00']
31,Steve Stern Fiction Reading,"Steve Stern is the author of several works of fiction, including the story collections Lazar Malkin Enters Heaven and The Wedding Jester, and the novel The Angel of Forgetfulness. His books have received several awards and fellowships and his work is included in numerous anthologies. He is currently a writer-in- residence at Skidmore College.",Map Museum of Art - Helmut Stern Auditorium,['2009-09-24 17:00']
32,Erb Colloquium: Xiaoli Zhao,"Professor Zhao is a visiting scholar at the Erb Institute. She is a Professor at North China Electric Power University. *Erb Institute Colloquium is a bi-weekly gathering to come together, have lunch and discuss the latest faculty and doctoral level research in sustainable enterprise from both within and outside the University.",Map Ross School of Business - K 1320,['2009-09-21 12:00']
33,"Understanding the Roles of Academic Preparation, Financial Resources, and Information in the College Enrollment of Underrepresented Students","Laura W. Perna, Associate Professor in the Graduate School of Education at the University of Pennsylvania, will discuss her recent research related to educational attainment for underrepresented students, the ways inadequate finances limit educational attainment, and the role of financial aid in addressing financial barriers.",Map Rackham Graduate School (Horace H.) - Assembly Hall,['2010-02-03 13:30']
35,"Bradley Chase, Albion College","The integration of Gujarat, a region outside of the Indus Valley proper, into the orbit of the Indus Civilization is a key feature of South Asia's first urban civilization. The nature of the social processes that accompanied this phenomenon, however, have been the subject of considerable debate since Harappan settlements in India were first identified in the 1950's. In this informal talk, I will discuss the results of my ongoing research, undertaken in collaboration with archaeologists from the Maharaja Sayajirao University in Baroda, which seeks to shed new light on these old debates by investigating the ways in which Harappan settlements were situated within the social and agropastoral landscapes of the Gujarati borderland.",Map Ruthven Museums Building - Room 2009,['2010-02-11 12:00']
36,Shift(s) in(g) the Humanities,"Bulbul Tiwari's digital performative dissertation, “Maha Multipedia: The Mahabharata reworked in mixed media for a nine night performance,” explores Indian visual culture of the last 2,000 years; it traverses ritual, classical dance-drama, folk theatre, sculpture, film and television narratives to create an original version of an ancient Indian epic. It was the first entirely digital dissertation at the University of Chicago and only the third of its kind in the U.S. In her talk she will begin by giving a guided tour of this project and then continue to discuss the pitfalls of her approach, the future of the project and perils of doing something new. Tiwari's work blurs the distinction between scholarship and documentary filmmaking and ranges from studies of the heritage of the great Indian epics to documentary films about self-employed women's associations in India, one act plays and ""Carriers,"" a film about truckers in India.",Map 202 S. Thayer - Room 2022,['2009-12-08 12:00']
37,Goldmine Pickers,"Goldmine Pickers perform innovative acoustic newgrass and swinging originals with a taste of Irish and jazz. The band started as a duo and has expanded to a four-piece ensemble of dedicated, versatile musicians. With guitar, upright bass, mandolin and a very versatile fiddle, they like to call themselves ""one banjo short"" of a bluegrass band. Lead vocals are shared among band members, who also join for three-part harmony. This band, which emerged from Goshen, Indiana's vibrant acoustic music scene, has focused on crafting a unique sound that nods to Americana genres while crossing traditional borders to create a fresh new sound -- one that draws audiences together.",,['2009-08-16 19:30']
38,Student Woodwind Chamber Music Recital,A recital of small mixed woodwind ensembles.,Map Walgreen Drama Center - Stamps Auditorium,['2009-11-19 20:00']
39,"Entering Canada to Visit, Work, Study, or Live","Are you thinking about visiting Canada? Are you thinking about studying or working in Canada? Or perhaps you are interested in living in Canada? Whether you are planning a short trip to Canada, are interested in working or studying in Canada, or would like to live there, there are specific requirements that you should understand. . For more details and the link to the workshop presentation, please visit our website below.",Map Rackham Graduate School (Horace H.) - 4th Floor Amphitheatre,['2010-04-08 14:00']
41,Weekend Masses at St. Mary's,"Wonder who else is Catholic and where they go every Sunday? Come meet them today! Experience liturgy at St. Mary's, where worship is inviting and focused on serving students and others who are part of the UM community. Our Mass schedule today is at 8:30 and 10, 10:10am, Noon, 2 pm (in Spanish), 5 pm, 7pm, and 9 pm. Questions? Call 663-0557 or email stmarys@umich.edu. All are welcome!",,"['2008-08-31 8:30', '2009-09-06 8:30']"
42,The Waybacks,"The Waybacks, based in the San Francisco Bay Area, have made the bluegrass charts and been praised for ""acoustic mayhem."" Now they're focusing on original songs and enjoying a refreshed repertoire - one that's touched by Memphis soul, honky-tonk, Parisian swing, classical music, vintage blue pop and much more besides. The Waybacks' current album, ""Loaded,"" seems ""like a mixtape made just for you by your infinitely cooler friend,"" says Juli Thanki of Popmatters. The Waybacks have toured with Grateful Dead founder Bob Weir, and whatever they do, they do with spontaneity. ""The whole spirit of improvisation--that's always been the cornerstone of this band for me,"" says founding singer, songwriter and guitarist James Nash. ""Through all the stylistic changes and regardless of the instruments we're playing, to me the fun of this band has always been that in some ways I can do whatever I feel like doing at any moment.""",,['2009-06-08 20:00']
43,"University Symphony Orchestra, Chamber Choir, University Choir","An extremely rare Ann Arbor community event: a live performance of the Berlioz Requiem. Kenneth Kiesler conducts this great setting of the Latin mass, with chorus, multiple antiphonal brass choirs, harps and timpani. A powerful, touching and magnificent expression of trepidation, acceptance, and consolation. Pre-concert lecture at 7:15 p.m.",Map Hill Auditorium -,['2009-12-11 20:00']
44,"SMTD at UMMA Lecture:  Born Like a Phoenix from the Ashes? The Renewal of French Music 1870-1918 (Jane Fulcher, UM) - RESCHEDULED FROM OCTOBER 23","This lecture examines both the truth and the myth of a dominant theme in the historiography of French music: that it was ""reborn,"" now following a progressive new path in the wake of the French defeat in the Franco-Prussian War of 1870. As it will demonstrate, the seeds of an independent new musical culture were already planted in the 1860s, after the foundation of the musical equivalent of the Salon des Réfusées – the Théatre Lyrique. From here it will examine those composers who emerged in this period, such as Gounod, Bizet, Saint-Saens and Chabrier, the latter becoming one of the first great collectors of impressionist painting. Finally, it will consider how Debussy was able to profit not only from academic institutions such as the Conservatoire, but from France's now thriving independent culture, which included the Symbolists and the Société Nationale de Musique FranÃ§aise.",Map Museum of Art - Auditorium,['2009-10-30 15:00']
45,Learning from the Community,"This workshop will cover a variety of topics surrounding volunteering abroad, such as how to find or create a good program, maintaining strong mutual relationships with the host site, managing language and cultural barriers, and more.",Map East Hall - 4448,['2010-02-09 18:30']
46,Guided Tour: Wrapped in Silk and Gold,"A guided tour of Wrapped in Silk and Gold: A Family Legacy of 20th-Century Japanese Kimono. Wrapped in Silk and Gold presents for the first time the Museum's recently acquired collection of deluxe kimono, haori, obi, and other traditional Japanese women's garments. Dating from the 1930s through the end of the 20th century, these garments trace changing fashions as the function of kimono changed over the course of time, as well as the arc of a woman's lifetime from youth to maturity. The works in the exhibition are the generous gift of the Yamaguchi family, and were made for and worn by a mother and daughter living in Tokyo. This exhibition is made possible in part by the University of Michigan's Center for Japanese Studies, the Michigan Council for Arts and Cultural Affairs, the Friends of the University of Michigan Museum of Art, the Charles H. & Katharine C. Sawyer Endowment Fund, The Japan Foundation, New York, the CEW Frances and Sydney Lewis Visiting Leaders Fund, and the Japan Business Society of Detroit Foundation.",Map Museum of Art,['2010-05-16 15:00']
47,Panhel Ethical Recruitment Workshop,Workshop for new members of Panhellenic sororities regarding the rules surrounding recruitment.,Map Michigan League,['2010-04-08 17:00']
49,Czech Documentary Film,"Cory Taylor, director. Documentary film about communist Czechoslovakia narrated by Jeremy Irons (78 min., 2009). Winner of the 2009 Mexico International Film Festival's Golden Palm Award.","Map Museum of Art - Helmut Stern Auditorium,",['2009-11-15 15:00']
50,Improving Children's Health Through Community-Engaged Research,"This workshop will feature prominent experts and dynamic breakout sessions to prepare you for conducting team science. The event will focus on developing academic and community partnerships to improve the health of children and youth, through collaborative, community-engaged research",,['2010-04-23 8:00']
51,Cedar Point,"RAIN OR SHINE Deadline: Wednesday, June 10, 2009. NO REFUNDS AFTER THIS DATE Register: In order to reserve your spot for this trip, you must sign up and pay in advance by the deadline at the front desk of the International Center on Central Campus (cash only and exact change is appreciated, thank you!). A UMID must be presented by the person purchasing the tickets. Limited space is available. Cost: $55/person (includes transportation and general admission to the park). Students, scholars friends and families welcome! Same price for all regardless of age. Children must be accompanied by an adult. Meeting time and location: We will be taking a bus together that will leave the International Center at 603 E. Madison Street. Please arrive at 8:00am so that we will be able to leave on time! Event description: Cedar Point is the largest Amusement Ride Park in the World! The park has 17 wild rides. With a lineup that includes three of the top 10 steel roller coasters in the world, Cedar Point is a coaster lover's dream come true. If you're looking for a thrill expect anything from rocking, rolling and rotating to being turned upside down, dropped suddenly or thrust upward at 50 mph. For those not interested in the roller coasters the park also offers a variety of more tranquil rides including three authentic operating carousels (which can take you back in time with their gentle whirling nature), a 150-foot giant ferris wheel, leisurely paddlewheel excursions, Cadillac and antique cars, or a ride on the Cedar Point and Lake Erie Railroad. Additionally, the park features four areas just for kids including Camp Snoopy, the Gemini Children's Area, Planet Snoopy and Kiddy Kingdom. Join us for a day of thrills and fun in the sun! For more information visit: http://www.cedarpoint.com Questions: Contact Andy at hicknera@umich.edu",,['2009-06-20 8:15']
52,"Senior Recital:  Marta Bagratuni, cello","PROGRAM: Beethoven - Sonata for cello and piano No. 4 in C Major, Op. 102, No. 1; Khudoyan - Sonata for Cello Solo No. 1; Rachmaninoff - The Lilacs Op. 21 No. 5, Loneliness Op. 21 No. 6, The Daisies Op. 38 No. 3; Otaka - Mieso; Haydn - Divertimento",Map Earl V. Moore Building - Britton Recital Hall,['2009-11-07 20:00']
53,Playfest 10:  ELBOW ROOM,"Staged reading. By Tedra Millan: ELBOW ROOM fulfills the symbolic smiling and frowning masks of theatre through its dark comedic style. Situated in a Philadelphia restaurant, the play follows nine individuals whose lives become entangled during the course of one evening. Relationships are revealed among strangers and the familiar while the Manhattans are being served. As someone is shouting from atop a table, ballroom dancing through the restaurant and blowing out the birthday candles once again”¦the ovens are heating up and so is the drama.",Map Walgreen Drama Center - Studio One,['2010-03-20 19:00']
54,"Masters Recital:  David Snyder, clarinet","PROGRAM: Brahms - Sonata for Clarinet and Piano No. 2 in E-flat Major; Zare - White on White; Paganini - Caprice No. 16; Schoenfield - Trio for Clarinet, Violin, and Piano",Map Walgreen Drama Center - Stamps Auditorium,['2010-03-29 20:00']
55,"Musicology Lecture:  Kugak Fusion, Kugak Confusion: Politics and Promotion in a New Old Korean Music - Keith Howard","Associate Dean, Research, and Professor, Sydney Conservatorium of Music, University of SydneyAs Korean musicians and organisations have digested the recent success of cutting-edge ""Korean Wave,"" so they have reassessed the way that Korean music is commodified and promoted, both in festivals in Korea and around the world. Locally, this is reflected in Kugak fusion, a genre that mixes Western harmonies and melodies with Korean soundworlds, and presented in spectacles that update traditional genres, incorporating technological wizadry, exuberant and outgoing performance, and flashy staging, in ways that are designed to appeal to new audiences. Powerful lobbies of performers and scholars within Korea who value traditional music, kugak, see in it a depth of identity that provides distinction, and reject Kugak fusion as a poor amalgam of East and West. Nor has the promotion of new genres been well received by foreign critics, revealing a distance between what is popular in Korea and what is popular abroad. This paper explores the discourse surrounding Kugak fusion within Korea and abroad.",Map Burton Memorial Tower - Room 506,['2010-01-26 14:30']
56,Lou & Peter Berryman,"Lou and Peter Berryman are musical humorists who have delighted nationwide audiences for more than 20 years. Frequent comparisons to Tom Lehrer (who said, ""I love your material, and if I were still performing, I'd steal it""), Flanders and Swann, and Burns and Allen notwithstanding, these two are originals, blending Midwestern culture with intelligent observation in a whimsical and wonderfully accessible performance. They have produced 12 albums and three songbooks of their original and hilarious, quirky, yet oddly profound music, and they've toured the U.S. and Canada to rave reviews. Lou and Peter Berryman songs are being sung around the world, by a legion of professional musicians including Peter, Paul & Mary, Peggy Seeger, and Garrison Keillor, as well as shower singers everywhere. The pair began their musical partnership in high school in Appleton, Wisconsin and their friendship survived a brief marriage before maturing into a durable creative collaboration.",,['2010-10-16 20:00']
57,"Lawrence Weschler, ""Mr. Wilson's Cabinet of Wonder""","Students in the Michigan Learning Communities (MLCs) will be reading a common book to begin their participation in the intellectual life of the University. In the Fall, students will be invited to participate in events related to Mr. Wilson's Cabinet of Wonder, as well as other theme semester events on campus. What is the book about? Mr. Wilson's Cabinet of Wonder is about a small, quirky Museum of Jurassic Technology maintained in a Los Angeles store-front by David Wilson. The book raises the issue of how we decide what is ""real"" and what is ""true"". It is a fascinating look at the convergences between art, science, perception and reality. Come Meet the Author! Author Lawrence Weschler will be coming to campus to talk about his book and the idea of convergences. He has been a staff writer for The New Yorker and is currently the Director of the Institute for the Humanities at New York University.",Map Power Center for the Performing Arts,['2009-09-15 16:30']
59,Danny Brit,"Danny Britt and his band Red Dawg have been favorites for years in Austin's vibrant nightclub scene. Danny writes and sings, and his music can sound like Willie Nelson, like the Eagles, or like Southern-fried modern folk -- it's pretty hard to put this guy in a box! He grew up in south central Kentucky playing everything from bluegrass to rock to classical music. Moving to Austin in 1980, Danny got a master's degree in progressive country music during a stint as Jerry Jeff Walker's road manager, and he's been making music with the Austin spirit ever since. Danny has toured with the likes of Guy Clark, Chris Smither, Chris Wall, Greg Trooper, and the original Dixie Chicks, and his fame extends as far as Belgium and Italy. Come and hear some classic sounds from the Live Music Capital of the World!",,['2010-07-26 20:00']
60,Gibson Brothers,"The Gibson Brothers are the bluegrass duo of Eric and Leigh Gibson, from Ellenburg Depot, New York, in the hardscrabble lands along the Quebec border. They've just released their ninth album, ""Ring the Bell,"" and like their earlier releases it grows organically out of the community and the experiences in which the brothers have taken part. There's beauty but also pain in the vivid storytelling of their songs. The Gibsons fit perfectly into the great tradition of brother duets, but they have a sound all their own, with sharp, often deeply moving songwriting and strong, ringing harmonies. Says Michael Eck of No Depression: ""To say they've got the classic brother duet thing down is an understatement; they own it.""",,['2009-10-11 19:30']
