id,title,desc,loc,date,tags
61,John Lee Hooker Jr.,"Says John Lee Hooker Jr.: ""If I tried to fill my father's shoes, I'd get cramps in my feet just trying to take one step."" John Lee Hooker Jr. is no clone of the late, great, and lamented Detroit bluesman, but instead he's something that's needed much more: an artist who carries forward the sardonic and funky sound and vision of Johnny ""Guitar"" Watson and other blues-based r&b artists of the 1970s and 1980s. John Jr. says that his sound is two parts r&b, one part jazz and downhome blues. It all adds up to an evening of great urban sounds and an artist who, whether he admits it or not, has some of the charisma of his famous father. His latest album, ""All Odds Are Against Me,"" garnered a Grammy nomination and has been burning up blues stages on both sides of the Atlantic",,['2009-08-17 20:00']
62,Circle K Mass Meeting,"Circle K is an international community service organization and is the collegiate level of Kiwanis. The mission of the University of Michigan Circle K is to develop leaders with a lifelong commitment to service. This year, our goal is to exceed 10,000 service hours! We sponsor various service projects with something for everyone. These service projects are all displayed on our online calendar (umcirclek.org/calendar.php). Anyone can sign up to do service with us, whenever you are free! Additionally, we strive to maintain a welcoming environment that fosters friendship amongst our members. Come learn more about Circle K at our fun travel themed mass meeting followed by a service social. Circle K takes you places!",Map Michigan Union - Anderson Room,['2009-09-21 19:00']
63,Freshman Evening of Spiritual Refreshment,"This special evening is open to all freshmen. You and your classmates are invited to explore your growing and changing relationships with family, friends, self, and God. Come, bring your friends and roommates, and celebrate the first month of your new life with a HOME COOKED MEAL and GREAT DESSERTS. Upper class students will share their own experience and encourage conversation and reflection on these important topics and also share concerns about classes, and opportunities for you at St. Mary's. For questions and to sign up call 663-0557 or email stmarys@umich.edu.",,['2010-09-24 18:00']
64,Ambassador John Beyrle,This will be a unique opportunity to hear from a leading public official about U.S. foreign relations policy under the Obama administration. Ambassador Beyrle will address what the highly publicized “reset” means and in what areas the Obama administration intends to concentrate its efforts.,Map Alumni Center - Founders Room,['2010-01-12 16:00']
65,The Hopwood Awards Ceremony,"Winners of the Winter Term creative writing contests administered by the Hopwood Awards Program are announced. Lecture by playwright, creenwriter and director John Patrick Shanley. Mr. Shanley won a Tony and Pulitzer Prize for his play ""Doubt,"" 5 Academy Award nominations for the film with Meryl Streep and Philip Seymour Hoffman including Best Adapted Screenplay, and an Academy Award for Best Original Screenplay for ""Moonstruck.""",Map Rackham Graduate School (Horace H.) - Auditorium,['2010-04-22 15:30']
66,The Career Center's Not-For-Profit Career Expo,"Connect with not-for-profit organizations right here on campus! Last year 30+ organizations attended representing a range of not-for-profit fields including social change, advocacy and community service. Use the Expo to: * Explore career paths in not-for-profits * Meet with employers to discuss internships full-time positions * Learn about volunteer opportunities * Build networks to expand your job search efforts For more information: http://www.careercenter.umich.edu/events/fairsevents/nfp.html",Map Michigan Union - Second Floor,['2010-02-10 15:00']
67,The Author's Forum Presents: American Salvage,"Michigan writer Bonnie Jo Campbell's American Salvage is rich with local color and peopled with rural characters who love and hate extravagantly. They know how to fix cars and washing machines, how to shoot and clean game, and how to cook up methamphetamine, but they have not figured out how to prosper in the twenty-first century. Today, Campbell and Lolita Hernandez discuss work and the inner lives of working-class characters in post-industrial America.",Map Harlan Hatcher Graduate Library - #100,['2010-05-15 17:00']
68,Trafford Tanzi,Dept. of Theatre & Drama Tickets available at the League Ticket Office 734-764-2538.,Map Walgreen Drama Center - Arthur Miller Theatre,['2010-04-11 14:00']
69,Zell Visiting Writers Series: Yusef Komunyakaa in Residence,"Yusef Komunyakaa's numerous books of poems include Talking Dirty to the Gods, Thieves of Paradise, which was a finalist for the National Book Critics Circle Award, Neon Vernacular: New & Selected Poems 1977-1989, for which he received the Pulitzer Prize and the Kingsley Tufts Poetry Award; Magic City, Dien Cai Dau, which won The Dark Room Poetry Prize, I Apologize for the Eyes in My Head, winner of the San Francisco Poetry Center Award, and Copacetic. He also co-edited The Jazz Poetry Anthology and co-translated The Insomnia of Fire by Nguyen Quang Thieu. His honors include the William Faulkner Prize from the Universite Rennes, the Thomas Forcade Award, the Hanes Poetry Prize, fellowships from the Fine Arts Work Center in Provincetown, the Louisiana Arts Council, and the National Endowment for the Arts, and the Bronze Star for his service in Vietnam, where he served as a correspondent and managing editor of the Southern Cross. In 1999, he was elected a Chancellor of The Academy of American Poets. Yusef Komunyakaa is the Senior Distinguished Poet in the Graduate Writing Program at NYU. Public reception to follow in the UMMA Forum",Map Museum of Art - Helmut Stern Auditorium,['2010-10-25 17:15']
71,(Re)Visionary Dances,"University Dance Company Paul Taylor’s Le Sacre du Printemps (The Rehearsal) with premieres by Amy Chavasse, Jessica Fogel, and Sandra Torijano. Tickets available at the League Ticket Office 734-764-2538.",Map Power Center for the Performing Arts -,['2010-02-07 14:00']
72,Art Under The Microscope: BioArtography Quilts,"This unique collection of art quilts is inspired by scientific photographs taken by researchers at the U-M Center for Organogenesis. In the course of diagnostic research, the microscope and special stains are used to examine tissues for alterations in structure or function that are characteristic of health or disease. The beauty of the photographs of these tiny biological structures, which is a fascinating combination of art and science, inspired this series of quilts by the Washington DC group, Fiber Artists @ Loose Ends. Fiber artists chose from among these BioArtography images to design their quilts. This traveling exhibit, sponsored by the Society for the Arts in Healthcare in partnership with Gifts of Art and the Center for Organogenesis, aims to honor these scientific research efforts, enrich community spaces by bringing the arts into everyday life and raise public awareness about the importance of the arts in healthcare settings.",,"['2009-11-13 8:00', '2009-11-14 8:00', '2009-11-15 8:00', '2009-11-16 8:00', '2009-11-17 8:00', '2009-11-18 8:00', '2009-11-19 8:00', '2009-11-20 8:00', '2009-11-21 8:00', '2009-11-22 8:00', '2009-11-23 8:00', '2009-11-24 8:00', '2009-11-25 8:00', '2009-11-26 8:00', '2009-11-27 8:00', '2009-11-28 8:00', '2009-11-29 8:00', '2009-11-30 8:00', '2009-12-01 8:00', '2009-12-02 8:00', '2009-12-03 8:00', '2009-12-04 8:00', '2009-12-05 8:00', '2009-12-06 8:00', '2009-12-07 8:00']"
73,Chamber Choir,"Jerry Blackstone, conductor. PROGRAM: Mendelssohn - Sechs Lieder, Op. 59, Mitten wir in Leben sing, Sechs Spruche, Op. 79, Zum Abendsegen, Duets and Lieder; Kuster - Bleed; Staheli - Peace Like a River",Map Walgreen Drama Center - Stamps Auditorium,['2009-10-09 20:00']
74,Symphony Band,"Michael Haithcock, conductor. “Dialogues and Entertainments”. Various musical connotations of the words dialogue and entertainment are explored as music of the distant past is juxtaposed with recent repertoire heavily influenced by pop culture. featuring Andy Hall (saxophone) and Jennifer Goltz (soprano). Pre-concert discussion at 7:15 on the lower level of Hill Auditorium featuring composer Michael Daugherty. PROGRAM: Gabrielli - Three Pieces; Bach - Tocata and Fugue in D Minor; Kraft - Dialogues and Entertainments; Ter Veldhuis - Tallahatchie Concerto; Daugherty - Bells for Stokowski",Map Hill Auditorium -,['2009-12-07 20:00']
75,CREES Brownbag,"Paul Werth, associate professor of history, University of Nevada, Las Vegas.",Map School of Social Work Building - 1636,['2010-02-10 12:00']
76,Dance BFA Concert:  happenchance on a blank body.,"An evening-length performance featuring the works of four senior dance majors, Betsy Busald, Catherine Coury, Elizabeth Dugas & Nadia Tykulsker with original music, poetry and text.",Map Dance Building - Betty Pease Studio Theatre,['2009-11-20 20:00']
77,9s Conversations on Europe/CREES Lecture.,"Grigore Pop-Eleches, assistant professor of politics and public and international affairs, Woodrow Wilson School of Public and International Affairs, Princeton University. Sponsors: CES-EUC, CREES, WCED. Part of “The Nines: Brinks, Cusps, and Perceptions of Possibility–from 1789–2009”",Map School of Social Work Building - 1636 II,['2009-12-10 16:00']
80,"Jews, Food, and Sustainability- what do these have in common?","Be part of a lunchtime discussion group that will study and discuss the Hazon sourcebook ""Food for Thought."" FRIDAYS, 12-1:00 pm, until December 11 at the commons area of the School of Natural Resources and Environment in the Dana Building. For more information contact Tilly @tillys@umich.edu.",Map Dana Natural Resources Building - Commons Area,"['2009-12-02 12:00', '2009-12-03 12:00', '2009-12-04 12:00', '2009-12-05 12:00', '2009-12-06 12:00', '2009-12-07 12:00', '2009-12-08 12:00', '2009-12-09 12:00', '2009-12-10 12:00', '2009-12-11 12:00']"
81,"Abalone Dots, Sam & Ruby","Sam & Ruby is the Nashville-based duo of Sam Brooker and Ghanaian-born Ruby Amanfu. Both accomplished performers and songwriters in their own right, they met at a writer's night in Nashville in 1999, began working together, and became what they call musical soulmates. Their song ""Heaven's My Home,"" was nominated for a Grammy in its recording by the Duhks and was featured in the film ""The Secret Life of Bees."" Sam & Ruby gently blend R&B, folk, and pop into a sound that's immediately warm and welcoming, but, Ruby says, ""We try not to fear honesty in our writing and tackle the things that hurt, the things that aren't always pretty. Sam & Ruby were recently named Discovery Artist of the Year by Sirius-XM radio's Coffee House channel. They're joined on tonight's show by Sweden's Abalone Dots, who mix bluegrass, country music, Swedish folk sounds, and harmony singing. Recording for the major label Sony/BMG, they performed at Nashville's legendary 12th & Porter club and basically blew away the crowd of assembled country music industry heavyweights. Naming Alison Krauss, Nickel Creek, Eva Cassidy, Joni Mitchell, the Trio (Dolly, Emmylou, and Linda), and the Be Good Tanyas as influences, they're poised to become Sweden's next big musical export, and they recently appeared at San Francisco's Hardly Strictly Bluegrass Festival.",,['2010-08-31 20:00']
82,MGC Weekly Meeting,Weekly meeting of the Multicultural Greek Council Executive Board and chapter representatives.,Map Palmer Commons - Great Lakes North,"['2009-11-04 21:00', '2009-11-11 21:00', '2009-11-18 21:00', '2009-12-02 21:00', '2009-12-09 21:00']"
83,Late Night Labyrinth Walk,"Want a chance to slow down and center yourself spiritually in the midst of a hectic week? Guild House Campus Ministry has a small labyrinth out front, that we will slowly walk by candlelight. A labyrinth is like a maze, except there is only one way in and out. The purpose is not to figure it out, but to focus on God's presence with us in the midst of the ordinary act of walking. Instructions will be given and snacks will be served.",,['2009-09-17 22:00']
84,Beethoven Piano Concerti - Concert 2,"Students of Christopher Harding and Kenneth Kiesler. Beethoven: Concerto for Piano and Orchestra No. 3 in C Minor, Op. 37 (Gjergji Gaqi, piano; Oriol Sans, conductor). Triple Concerto for Piano, Violin, Cello and Orchestra in C Major, Op. 56 (Aya Yamamoto, piano; Matthew Leslie, violin; James Jaffe, cello; Avlana Eisenberg, conductor)",Map Earl V. Moore Building - Britton Recital Hall,['2010-02-21 17:00']
85,Mardi Gras Sale-a-bration at the U-M Computer Showcase,"On February 16, take an additional 6% off any Apple product in stock. Save on all Apple computers, iPods, software, and accessories. Shop from 9:00 a.m. - 6:00 p.m. at the stores in the Michigan Union (ground floor) and Pierpoint Commons (main concourse). Offer valid only at the U-M Computer Showcase.",Map Michigan Union - U-M Computer Showcase (ground floor),['2010-02-16 9:00']
86,Trevor Hall,"A South Carolina native who has been writing songs since he was 14 and who was influenced by Bob Dylan, Bob Marley, Ben Harper and Bjork. He blends reggae, folk, and roots-rock and has recently toured with Matisyahu and visited India, which influenced his values and music-making.",,['2009-08-09 19:30']
87,Jewish Greek Council Shabbat at AEPi,Come by AEPi at 8pm on October 9th for Jewish Greek Council Shabbat.,,['2009-10-09 20:00']
88,Unlimited Pool & Games at the Billiards Room,Pay $3 on Sunday and Monday nights after 9pm and you will receive all the free billiards and pool you want. Offer valid for UM students only; must show M-card.,Map Michigan Union - Billiards Room,"['2009-09-20 21:00', '2009-09-21 21:00', '2009-09-27 21:00', '2009-09-28 21:00', '2009-10-04 21:00', '2009-10-05 21:00', '2009-10-11 21:00', '2009-10-12 21:00', '2009-10-18 21:00', '2009-10-19 21:00', '2009-10-25 21:00', '2009-10-26 21:00', '2009-11-01 21:00', '2009-11-02 21:00', '2009-11-08 21:00', '2009-11-09 21:00', '2009-11-15 21:00', '2009-11-16 21:00', '2009-11-22 21:00', '2009-11-23 21:00', '2009-11-29 21:00', '2009-11-30 21:00', '2009-12-06 21:00', '2009-12-07 21:00', '2009-12-13 21:00', '2009-12-14 21:00', '2009-12-20 21:00', '2009-12-21 21:00', '2010-01-03 21:00', '2010-01-04 21:00', '2010-01-10 21:00', '2010-01-11 21:00', '2010-01-17 21:00', '2010-01-18 21:00', '2010-01-24 21:00', '2010-01-25 21:00', '2010-01-31 21:00', '2010-02-01 21:00', '2010-02-07 21:00', '2010-02-08 21:00', '2010-02-14 21:00', '2010-02-15 21:00', '2010-02-21 21:00', '2010-02-22 21:00', '2010-02-28 21:00', '2010-03-01 21:00', '2010-03-07 21:00', '2010-03-08 21:00', '2010-03-14 21:00', '2010-03-15 21:00', '2010-03-21 21:00', '2010-03-22 21:00', '2010-03-28 21:00', '2010-03-29 21:00', '2010-04-04 21:00', '2010-04-05 21:00', '2010-04-11 21:00', '2010-04-12 21:00', '2010-04-18 21:00', '2010-04-19 21:00', '2010-04-25 21:00', '2010-04-26 21:00']"
89,Combat Trauma & the Trials of Homecomming,"Acclaimed psychiatrist and best selling author, Dr. Jonathan Shay is a recent winner of the MacArthur Foundation's Genius Award for his unique perspective on the psychological impact of war. In his two books “Achilles in Vietnam: Combat Trauma and the Undoing of Character” & “Odysseus in America: Combat Trauma and the Trials of Homecoming” he examines the experiences of combat veterans through the lens of the classical texts The Illiad, The Odyssey and The Aeneid. The lectures are free and open to the public.",Map Rackham Graduate School (Horace H.) - Auditorium,['2009-09-23 17:00']
90,Faculty Follies,"U-M Art & Design faculty members Holly Hughes, Danielle Abrams, Nick Tobier, Malcolm Tulip present an evening of performance work. Hughes and Abrams will perform a sketch devised by Digby Wolfe, the original writer of ""Rowan and Martin's Laugh In"". Tobier will reveal how he interacts with and shifts the streets and cities in which we live. Tulip will showcase his considerable skills as a physical theater artist. Amanda Krugliak presents her wry and incisive monologues and Melanie Manos offers a multi-disciplinary blend of punk rock and surreal action.",Map Duderstadt Center (Media Union) - Video and Performance Studio,"['2009-09-18 20:00', '2009-09-19 20:00']"
91,San Francisco Symphony,"Michael Tilson Thomas, conductor; Christian Tetzlaff, violin The San Francisco Symphony and music director Michael Tilson Thomas kick off their two-day educational and performance residency with a performance that features some of Stravinsky's most well-known works and the Tchaikovsky Violin Concerto, last performed on a UMS program over a decade ago by Elmar Oliveira and the Chicago Symphony. This performance features violinist Christian Tetzlaff as soloist. Tetzlaff, who performed a recital of solo violin works in 2008 at Hill Auditorium, is internationally recognized as one of the most important violinists of his generation whose musical integrity, technical assurance, and intelligent, compelling interpretations have set the standards to which violin performances are measured. Program · Kissine : New Work Commissioned by SFS (2009) · Tchaikovsky : Violin Concerto in D Major, Op. 35 (1878) · Ravel : Valses nobles et sentimentales (1912) · Liszt : Symphonic Poem No. 2: Tasso – Lament and Triumph, S. 96 (1849)",Map Hill Auditorium,['2010-03-19 20:00']
92,Future of Urbanism,"University of Michigan's Taubman College of Architecture and Urban Planning will host a conference, Future of Urbanism, March 19 & 20, 2010. An international roster of speakers – academics and practitioners – will address some of the most critical issues facing our cities and their environs in six sessions, comprised of 15-minute segments and a panel discussion. The presentations are free and open to the public. Please visit website to register.",Map Rackham Graduate School (Horace H.) - Auditorium,['2010-03-19 16:30']
93,Backpacking - Sleeping Bear Dunes National Lakeshore,"Fri, June 25-Sun, June 27 Register: To register for the trip, please phone or stop by the Outdoor Adventures Center (336 Hill Street) during business hours. Event description: Spend a weekend hiking the Sleeping Bear Dunes National Lakeshore! The park was established primarily for its outstanding natural features, including forests, beaches, dune formations, and ancient glacial phenomena on the shores of Lake Michigan. We will leave Friday afternoon and camp at a front-country site Friday night. On Saturday, we will hike a 5-8 mile stretch of the dunes, stopping for lunch along the way. On Sunday, we will hike 1-3 miles and depart for Ann Arbor in the early afternoon. This short trip is sure to relax and entertain you, as we enjoy the unique environment. No need to have prior experience. Necessary skills will be taught before and during the trip. For more detailed information about the trip including pre-trip meeting, visit Outdoor Adventure Trips This event is cosponsored by the International Center and U-M Rec Sports Outdoor Adventures. Questions: Contact Lindsey MacDonald at lindsey.e.mac@gmail.com or call 734-764-3967",,"['2010-06-25 16:00', '2010-06-26 16:00', '2010-06-27 16:00']"
94,"MOLS Tens, Tarps, and Shelters Clinic","Looking to learn the ins and outs of setting up a variety of shelters? Simply wondering about tent set up basics? Or maybe how to decide where to put your shelter in the first place? In this clinic you will be exposed to a variety of tent types, practice hanging tarps, discuss other options for shelter, and learn how to select a (relatively) comfortable and low–impact campsite for any shelter type.",,['2009-10-22 18:30']
95,"Student Recital:  Peter DiLeo, Nicholas Rifken and Jonathan Larson, percussion",PROGRAM: Whibley - Blue Motion; Norton - November Evening; Kotche - Monkey Chant; Kopetzki - Wooden Delight; Hollinden - Focusing Your Awareness Into Slender Beams of Solid Rhythm; Sammut - Libertango; Westlake - Omphalo Centric Lecture,Map Earl V. Moore Building - McIntosh Theatre,['2010-04-17 17:00']
96,The 9th Annual One Love Show,"The One Love Step Show is an annual event put on by Zeta Sigma Chi Multicultural Sorority, Inc. to showcase the cultural diversity, unity, and pride of various organizations on the U of M campus. With its focus being multiculturalism, the step show consists of several acts by various organizations which perform dances, step, recite spoken word, or sing. Among these are Asian dancing groups, Multicultural Greek Council organizations, National Pan-Hellenic Council organizations, modern and jazz dance groups, a capella groups, Arab and Indian dance groups, as well as many other organizations.",Map Michigan League - League Ballroom,['2009-11-14 18:30']
97,Opera Workshop:  A Midsummer Night s Dream,"by Benjamin Britten. Joshua Major, director; Timothy Cheek, music director.",Map Earl V. Moore Building - McIntosh Theatre,['2010-04-07 19:30']
98,Long-Term Employment Authorization Options: H-1B and Permanent Residency,"Designed for international students who plan to work in the U.S. following graduation, as well as internationals who are currently employed or are seeking employment at U-M. Topics covered include H1-B Temporary Work Visa, Employment-Based U.S. Permanent Residency, basic eligibility requirements, and specific procedures. Presenter: The speaker, Vicky Farah, one of U-M's retained immigration attorneys, is a lifelong Michigan resident who has been practicing immigration and nationality law for over 24 years. She has a Juris Doctor degree from Wayne State University. Vicky has been a member of the American Immigration Lawyers Association (AILA) Michigan Chapter since 1981. Co-sponsored by Rackham Graduate School and the International Center. Workshop Preparation: The handout for the workshop, Long Term Employment Authorization Options: H-1B and Permanent Residence pdf icon is available online. Be advised that this handout will not be provided at the workshop. So please remember to print and bring it with you to the workshop so you can follow the presentation. If you have questions about the handout, please save your questions for the workshop.","Map Rackham Graduate School (Horace H.) - Assembly Hall, 4th Floor",['2009-07-31 14:00']
99,International Student Orientation: Finding Scholarly Articles,Academic work requires that you locate scholarly information to support your research and teaching. We will use the Librarys Search Tools site and other resources to look at how to locate scholarly articles from academic journals. This session is geared toward international students.,Map Shapiro Harold & Vivian Library - 4059,['2009-10-02 11:00']
100,Kitty Donohoe,"The Michigan roots music of Detroit native Kitty Donohoe, it's been said, has a luminous yet earthy sound. Kitty has a three-octave range and a haunting stage presence that have consistently been gaining her new fans since the late 1980s. Her latest album, ""Northern Border,"" features Canadian sounds and has earned raves: Sing Out! calls her ""one of the rare singer-songwriters to sensuously weave words and melody into a strong and mezmerizing fabric. Her melodies, redolent with Celtic flavors, wrap themselves around her flowers of words."" Well known to Michigan audiences, Kitty recently appeared at the Kennedy Center for the Performing Arts in Washington and opened for Don McLean at the legendary Birchmere club in Alexandria. She performed""There Are No Words,"" written on the afternoon of September 11, 2001, at the dedication of the Pentagon's 9/11 memorial.",,['2010-02-11 20:00']
101,Linda and Ali: Two Worlds Within Four Walls,"Ali Saigal and his wife Linda have been married for 20 years, raising their traditional Islamic family in Doha, Qatar. But their relationship is far from traditional–Linda was brought up Catholic in Arizona and met Ali at college in the 1980's. Shot over two years during the American invasion of Iraq, this poignant doc shows how Linda and Ali struggle to surmount their cultural differences while raising their seven children in a lively, loving home. Unlike many foreign wives, Linda adopted the Shiite Muslim traditions of her husband, and swathed in black, she looks like any other Qatari woman. Within the four walls of their comfortable home, however, Western and Middle Eastern ideals, ethics and attitudes often collide. The filmmaker hones in on surprising and candid family discussions about issues such as second wives, religion and Qatari society, painting a fascinating portrait of a family living at the complex intersection of gender roles, nationality and religion. This entertaining film is a unique opportunity to view Muslim culture through Linda's eyes, counteracting the often distorted images provided by the mainstream media.",Map School of Social Work Building - Room 1636,['2010-02-08 12:00']
102,InFocus-The Environment,"Come check out InFocus Wednesday, Februaray 3rd in the Michigan League! InFocus is a new event that works to highlight and educate students about hot topics in the news. This InFocus will be highlighting the environment. Student Groups will be there for you to check out and become involved with. Then a student panel, facilitated by Prof. Virginia Murphy will help inform you of how your actions affect the environment and what you can do to help. A showing of Leonardo DiCaprio's movie, ""The 11th Hour"" will follow with FREE popcorn, cookies and refreshments! See you at 6:00, Wednesday, Feb. 3rd at the Michigan League.",Map Michigan League - Vandenburg Room,['2010-02-03 18:30']
