id,title,desc,loc,date,tags
103,"Third Dissertation Recital:  Jacqueline Nutting, violin",PROGRAM: Good - and dreams rush forth to greet the distance; Holbrook; Murphy - Dance Me to Your Beauty With a Burning Violin; Rolfe - Drop; Sokolovis - Cinque Danze,Map Walgreen Drama Center - Stamps Auditorium,['2010-04-10 20:00']
104,Translation Lecture,"Guest Lecture by Dr. Tim Whitmarsh, E. P. Warren Praelector in Classics, Corpus Christi College, Oxford University, With Comments by, George Economou, Emeritus Professor of English, University of Oklahoma",Map Angell Hall - 2175 - Classics Library,['2009-11-23 16:00']
105,Musical Theatre Senior Showcase,"Each year the seniors in the Musical Theatre Department present a showcase in New York City for casting directors and agents. See the show in Ann Arbor before they head to NYC! Limited seating available. Tickets on sale beginning September 8, 2009. League Ticket Office 734-764-2538.",Map Lydia Mendelssohn Theatre -,['2010-05-02 19:30']
106,Optional Practical Training (OPT),"Optional Practical Training (OPT) is a way for F-1 international students to obtain up to 12 months of permission to work in the United States. Generally this work permit is used during summer vacation or after graduation. If you are planning to apply for Optional Practical Training work authorization this term, you must attend one of these workshops. At the workshop, an advisor will explain the OPT application process and answer any questions so that you will have the information you need to fill out the forms correctly. At the end of the workshop, the advisor will collect the completed OPT applications. The International Center will then issue a new I-20 for OPT for you and you will be notified by email when the form is ready. No appointment with an advisor will be required. Pre-requisites: Follow the procedure in Optional Practical Training (OPT) for F-1 Students. Be sure to bring all of the documents listed in the Documents Needed to Apply for OPT section.",Map Michigan Union - Anderson Room,['2009-08-06 10:00']
108,"""International Intellectual Property Law: A View from the World Intellectual Property Organization (WIPO)""","Speaker: Edward Kwakwa, Legal Counsel, World Intellectual Property Organization (WIPO) The International Law Workshop introduces today's most debated issues in international and comparative law. Speakers will talk for 25 minutes, followed by discussion and questions.",Map Hutchins Hall - 116,['2010-02-22 16:00']
109,Panhel Women Leading Women Conference,Annual leadership conference for the executive boards of the Panhellenic Sororities.,Map Michigan League,['2010-01-31 13:00']
112,Conversations on Europe.,"Zsuzsa Gille, associate professor of sociology, University of Illinois at Urbana-Champaign.",Map School of Social Work Building - 1636,['2010-04-15 16:00']
113,"Senior Recital:  Camran Wilson, French horn","PROGRAM: Strauss - Horn Concerto No. 2 in E-flat Major, Op. 132; Schnyder - Le Monde Miniscule; Glazunov - Reveries for Horn and Piano in D-Flat Major, Op. 24; Bach - Transcriptions of Bach arranged for Brass Quintet; Reynolds - Partita for Solo Horn",Map Earl V. Moore Building - Britton Recital Hall,['2010-04-29 20:00']
114,Berlin Philharmonic,"Founded during UMS's third season in 1882, the Berlin Philharmonic has long been considered one of the world's finest orchestras. Hans von BÃ¼low catapulted the orchestra into one of the leading orchestras in Germany in the late 19th century, and lengthy tenures by Arthur Nikisch, Wilhelm FurtwÃ¤ngler, Sergiu Celibidache, and Herbert von Karajan further cemented their stature. The ensemble's most recent UMS appearance, in 2001 was under Claudio Abbado's leadership; a year later, the musicians voted Sir Simon Rattle as their new music director after a 15-year collaboration. Born in Liverpool, Rattle has conducted many of the world's great orchestras and served an 18-year tenure as head of the City of Birmingham Symphony Orchestra in England. In addition to his duties in Berlin, he regularly guest conducts the Vienna Philharmonic, the Philadelphia Orchestra, and other celebrated ensembles. Rattle makes his UMS debut with this appearance, which features Brahms' final two symphonies as well as film music composed by Schoenberg. This exclusive tour will include only three U.S. cities – New York, Chicago, and Ann Arbor. Program · Brahms : Symphony No. 3 in F Major, Op. 90 (1883) · Schoenberg : Begleitmusik zu einer Lichstspielszene, Op. 34 (1929-30) · Brahms : Symphony No. 4 in e minor, Op. 98 (1884-5)",Map Hill Auditorium,['2009-11-17 20:00']
116,Optional Practical Training (OPT),"Optional Practical Training (OPT) is a way for F-1 international students to obtain up to 12 months of permission to work in the United States. Generally this work permit is used during summer vacation or after graduation. If you are planning to apply for Optional Practical Training work authorization this term, you must attend one of these workshops. At the workshop, an advisor will explain the OPT application process and answer any questions so that you will have the information you need to fill out the forms correctly. At the end of the workshop, the advisor will collect the completed OPT applications. The International Center will then issue a new I-20 for OPT for you and you will be notified by email when the form is ready. No appointment with an advisor will be required. Pre-requisites: Follow the procedure in Optional Practical Training (OPT) for F-1 Students. Be sure to bring all of the documents listed in the Documents Needed to Apply for OPT section.",Map Pierpont Commons - Boulevard Room,['2009-07-21 15:00']
117,SMTD at UMMA: Musical Contemporaries of the Impressionists,"The desire for a creative milieu independent of established French institutions was shared by visual artists and composers alike in the second half of the nineteenth century. This program features vocal and instrumental solo and chamber works by independent composers such as Emmanuel Chabrier, Camille Saint-Saens, Georges Bizet, Henri Duparc, and Cesar Franck, performed by SMTD students.",Map Museum of Art -,['2009-10-21 20:00']
118,Pollinator Pyramid,"All invited to view the “Pollinator Pyramid,” a short film on creating a pollinator-safe sanctuary in your yard. Followed by a discussion by the film's creator–Washtenaw County Environmental Media Specialist Barbara Lucas–and Richard Mendel, organizer of the Ann Arbor Backyard Bee group and volunteer beekeeper at Matthaei.",Map Dana Natural Resources Building - 1006,['2010-06-25 12:00']
119,"Fragment, Border, Region, Route, World:","A brown bag with Vilashini Cooppan, Associate Professor of Humanities at UC, Santa Cruz.",Map Tisch Hall - 2024,['2010-02-19 12:00']
120,Global Information Week,"A series of events at the UGLi, happening all week! Are you interested in global justice or foreign study? Then come on in and check it out! For a full list of events, please see the website.",Map Shapiro Harold & Vivian Library - Varies by event.,"['2010-03-22 12:00', '2010-03-23 12:00', '2010-03-24 12:00', '2010-03-25 12:00']"
121,"W Richard West, Jr. National Museum of the American Indian:","The National Museum of the American Indian's opening in 2004 at the head of the National Mall in Washington DC turned a page in American history by recognizing and affirming the primary place of Native peoples as the First Citizens of the Americas and as an integral element of American heritage. The inauguration of the Museum also transformed and expanded the definition of the term ""museum"" far beyond the 20th century convention and practice -- from a stop on the tour bus route to a gathering place and forum of national and international reach for representation discussion and debate. 11th annual William R. Farrand Lecture of the Exhibit Museum of Natural History.",Map Museum of Art - Helmut Stern Auditorium,['2009-09-30 19:30']
122,Mass Meeting,Come to find out more about HRTE and eat some wonderful goodies!,Map Mason Hall - Perlman Honors Commons,['2009-09-15 21:00']
123,First Shabbat Dinner,Join us for a gourmet Shabbat dinner every Friday night at no charge. Come for services (7:00) or dinner (8:00) or both. Dress however you like.,Map Hillel (Mandell L Berman Center),['2010-09-03 19:00']
124,University of Michigan Chess Club,Come join the Chess Club from 7-9 every Monday evening to play and converse with other chess club members. There is also free drop in play from 2-7pm on Fridays in the Tap room!,Map Michigan Union - Tap Room,"['2009-09-28 19:00', '2009-10-05 19:00', '2009-10-12 19:00', '2009-10-26 19:00', '2009-11-02 19:00', '2009-11-09 19:00', '2009-11-16 19:00', '2009-11-23 19:00', '2009-11-30 19:00', '2009-12-07 19:00', '2009-12-14 19:00']"
125,LSA Collegiate Chair Inaugural Lecture. “Affective Communities: The Contradictions of National and Soviet Identity in the USSR.”,"Ronald G. Suny, Charles Tilly Collegiate Professor of Social and Political History and professor of history, U-M. Sponsor: LSA.",Map Rackham Graduate School (Horace H.) - Amphitheatre,['2009-12-08 16:00']
126,Poker Tournaments,Every Monday night is a chance to win $20 of munchie money. Come by 5:45 to sign up and enter the weekly tournament.,Map Michigan Union - U-Club,"['2009-09-28 18:00', '2009-10-12 18:00', '2009-10-26 18:00', '2009-11-02 18:00', '2009-11-16 18:00', '2009-11-23 18:00', '2009-11-30 18:00', '2009-12-07 18:00', '2009-12-14 18:00', '2010-01-11 18:00', '2010-01-18 18:00', '2010-01-25 18:00', '2010-02-01 18:00', '2010-02-08 18:00', '2010-02-15 18:00', '2010-02-22 18:00', '2010-03-08 18:00', '2010-03-15 18:00', '2010-03-22 18:00', '2010-03-29 18:00', '2010-04-05 18:00', '2010-04-12 18:00', '2010-04-19 18:00']"
127,EEB Thursday Seminar Series: Ecological and evolutionary responses of small mammals to late Quaternary climatic change,"Abstract: Environmental change has always impacted the Earth's biota. Extracting the responses of populations, species and communities to perturbations of the past is one of the best ways of unraveling how they will respond to perturbations of the future. Historic data from large environmental events such as the Pleistocene-Holocene transition and the Medieval Warm Period (MWP) provide a unique opportunity for insights into resilience of mammals in communities. The transition from the cold, arid Late Pleistocene (LP) glacial period to the warm, mesic Holocene interglacial witnessed extinction of many mammals in North America: 70 of ~220 of the largest species (32%) disappeared due to climatic and human stressors. The smaller mammalian survivors of the extinction (e.g., voles, gophers, ground squirrels, etc.) persisted but showed range changes, species turnover, diversity decline and significant alteration of population structure. I propose that study of historic responses to past climatic change fosters a richer understanding of the future. I demonstrate how populations and species interacted with their prehistoric environments to persist: by reshuffling individuals, increasing or decreasing population size, and favoring particular genotypes, all of which leave a mark on communities. Empirical evidence of this dynamic remains difficult to obtain, but a phylochronologic approach makes it possible.",Map Chemistry & Willard H Dow Laboratory - 1200,['2010-03-11 16:00']
128,Ivan Karp: Museums and Their Communities or Communities and Their Museums,"In 1992 I published two essays as part of the edited volume, Museums and Communities: The Politics of Public Culture. At that time it seemed sufficient to characterize the relationships among museums and communities as varied and complex, mediated by the two elements of the civil societies of which they are a part and the complex and often contradictory social identities that museum professionals and members of the museum audience bring to the museum encounter. Since then both the world we live in and our sense of how it works has changed underneath us. While we know that museums have always been global institutions, increasingly salient and contradictory processes of globalization and the development of global cultural institutions have become more and more significant aspects of the environment in which museums operate and live or die. In addition the spread of technology in such fora as data collection, collecting and storage, and exhibition are more and more part of the ways in which museums and communities relate. This paper rethinks the politics of institution, society and identity as they have been affected by changing social and cultural processes over the last fifteen to twenty years, using as case studies the papers presented at this colloquium. The cases here include colonial museums, changing community museums and studies of how different local communities have made use of museums. The paper examines how these examples can illuminate processes of governmentality, changing identity claims and possible new roles for museums in society.",Map Museum of Art - Helmut Stern Auditorium,['2010-03-30 19:30']
129,EIHS Thursday Lecture,"Professor from University of California, Irvine ""Economies of Death and Salvation: German Jesuits in Seventeenth-Century Oceana"" Located in 1014 Tisch Hall, 4-6 PM",Map Tisch Hall,['2010-04-08 16:00']
130,Improfessionals Winter Performance,"Come support Hillel's very own improv troupe, the Improfessionals. They perform this Saturday night at Michigan League. The Laughing will begin at 8:00 pm.",Map Michigan League,['2009-12-05 20:00']
132,The Policy and Politics of the Michigan Prisoner ReEntry Initiative,"Panelists are: Patricia L. Caruso, Director of the Michigan Department of Corrections, 2003-present; Peter Luke, veteran reporter with Booth Newspapers; John Proos, State Representative (R-St. Joseph), Vice-Chair of the House Appropriations Subcommittee on Corrections; Alma Wheeler Smith, State Representative (D-Ann Arbor), Chair of the House Appropriations Subcommittee on Corrections; Moderator: Jeffrey D. Padden, President of Public Policy Associates, Inc. The panel will discuss the current policy framework of the Michigan Prisoner ReEntry Initiative (MPRI), the politics of the initiative within the Michigan legislature, and the effect of public criticism on its future. Their perspectives will include that of the top official of the Michigan Department of Corrections, the Democratic chair and Republican vice-chair of the House Appropriations Subcommittee on Corrections, and a keen observer of Michigan government who has been a newspaper reporter for over 25 years. This event is organized by professors Jeffrey Morenoff and David Harding. Event is free and open to the public.",Map Weill Hall - Annenberg Auditorium/Rm 1120,['2010-03-29 16:00']
133,"Science, Technology and Public Policy (STPP) Lecture","The speaker is David Vogel, Solomon P. Lee Chair in Business Ethics, Haas School of Business and professor of political science, University of California, Berkeley.",Map Weill Hall - Betty Ford Classroom 1110,['2009-09-21 16:00']
134,Optional Practical Training (OPT),"Optional Practical Training (OPT) is a way for F-1 international students to obtain up to 12 months of permission to work in the United States. Generally this work permit is used during summer vacation or after graduation. If you are planning to apply for Optional Practical Training work authorization this term, you must attend one of these workshops. At the workshop, an advisor will explain the OPT application process and answer any questions so that you will have the information you need to fill out the forms correctly. At the end of the workshop, the advisor will collect the completed OPT applications. The International Center will then issue a new I-20 for OPT for you and you will be notified by email when the form is ready. No appointment with an advisor will be required. Pre-requisites: Follow the procedure in Optional Practical Training (OPT) for F-1 Students. Be sure to bring all of the documents listed in the Documents Needed to Apply for OPT section.",Map Pierpont Commons - Boulevard room,"['1969-12-31 19:00', '1969-12-31 19:00', '1969-12-31 19:00', '1969-12-31 19:00']"
135,"""The Nutcracker""","Ann Arbor Ballet Theater presents the 25th Anniversary presentation of Tchaikovsky's ""The Nutcracker"". A holiday tradition that will last forever!",Map Power Center for the Performing Arts,"['2009-12-19 14:00', '2009-12-20 14:00']"
136,Student Composers Forum,PROGRAM: Pertz - the Drink of the Wise; Matlock - Three Characters; Foumai - Hanakotoba; Amchin - Hypnagogia; Kern - Chicken Walker; Peres - Ecstatic Mushrooms in a Controlled Environment; Mueller - Rounds; Kalb - String Trio; Shin - The First Essay; Crosmer - Chrysalis Infinitum,Map Earl V. Moore Building - Britton Recital Hall,['2010-01-21 19:30']
137,"Masters Recital:  Alex Young, trumpet",PROGRAM: Handel - Let the Bright Seraphim; Stevens - Sonata for Trumpet and Piano; Hindemith - Septet for Wind Instruments; Ewazen - An Elizabethan Songbook,Map Walgreen Drama Center - Stamps Auditorium,['2010-03-22 17:00']
138,Ramblin' Jack Elliott,"""I've heard a lot of wonderful stories about myself, enviable -- I wish I could've done it,"" says Ramblin' Jack Elliott (whose nickname comes from his storytelling style). Everybody has a story about this folk legend, and some of the stories are myths. The truth is that Ramblin' Jack has not only taught but also learned something from everyone he's ever met and made music with. Ramblin' Jack's career has crossed paths with musicians ranging from the singing cowboys he worked with after running away from home in New York, to Woody Guthrie (much of whose music he transmitted to the world), to Arlo Guthrie, Bob Dylan, Phil Ochs, and Tom Russell, all of whom he mentored or directly influenced. Ramblin' Jack Elliott is a true American treasure whose recent recording work on the Anti- label has brought him a new group of fans who are two or three generations younger than he is. His latest release, ""A Stranger Here,"" recently won a Grammy for Best Traditional Blues Album.",,['2010-09-14 20:00']
139,Rolling Sculpture Car Show,"Location: Main Street, Ann Arbor Deadline: Wednesday, July 8, 2009 Register: Email Andy Hickner at hicknera@umich.edu with your name, phone number, and how many people (friends/family members) you will bring with you, if any. Cost: Tour is FREE. You are responsible for the cost of your dinner. Students, scholars, friends, and families are welcome. Children must be accompanied by an adult. Meeting Location: Please arrive at 5:00pm at the International Center (603 East Madison) and we will walk together to Main Street (estimated 20 minutes). Event Description: Bill Crispin Chevrolet and the Main Street Area Association present the 15th Annual Rolling Sculpture Car Show on July 10th. The event features more than 400 exotic, antique, classic, concept cars on Main, Liberty, Fourth, and Washington in the heart of downtown. The show also features a special Dream Street exhibition area on Liberty between Fourth and Fifth, including educational and race car demonstrations. The group will have dinner together at a nearby restaurant at 6:30pm. Please bring money for your dinner. We will decide where we will eat when the group meets. For more information about this event, please visit the site: http://mainstreetannarbor.org/2009/04/rolling-sculpture-car-show-july-10-2009/ You may have talked with Joseph (Joe) DuPont at the International Center's front desk. This is an opportunity to see him in a new role as Surfer Joe the DJ at this event: http://www.surferjoeproductions.com Questions: Contact Andy at hicknera@umich.edu",,['2009-07-10 17:00']
141,Divine Sky: The Artistry of Astronomical Maps,"Participants can view a virtual exhibit of 17th, 18th and 19th century astronomical atlases, maps, charts and illustrations from the collections of the Map Library and Shapiro Science Library. For more information go to www.lib.umich.edu/science/astro/maps.",Map Shapiro Harold & Vivian Library - Third floor,"['2009-07-31 0:00', '2009-08-01 0:00']"
142,Understanding Alzheimer,"Please join The Michigan Institute for Clinical and Health Research, the Health Sciences Libraries, and Ann Arbor District Library at this symposium to learn about Alzheimer's disease and the associated complications of memory loss. In addition to learning about information generated from the latest research on Alzheimer's disease, as well as research study opportunities, participants will hear about tips and resources that increase comfort, help maintain activity, and help people cope.",,['2009-08-27 19:00']
143,"STMD at UMMA:  Bright Sheng, composer","SMTD faculty composer Bright Sheng presents his own works, A Night at the Chinese Opera, Three Chinese Love Songs, Seven Tunes Heard in China, and the Third String Quartet. They are juxtaposed with studies in orientalism by Maurice Ravel and Bela Bartok. Sheng is joined by fellow SMTD faculty Stephen Shipps and Logan Skelton, the Phoenix Ensemble, DMA cellist Paul Dwyer, and guest artist Jennifer Goltz.",Map Museum of Art - Apse,['2010-03-21 16:00']
144,Patricia Hampl,Memoirist Patricia Hampl (University of Minnesota) reads from her work. This reading is part of the U-M MFA in Creative Writing Program's Zell Visiting Writers Series.,Map Museum of Art - Helmut Stern Auditorium,['2009-11-05 17:00']
145,Student Chamber Music Recital: Michigan Double Reed Ensemble,PROGRAM: Zelenka - Sonata II; Gabrielli - Canzoni per Sonar A 4; Palestrina - Missa Papae Marcelli; Corelli - Sonata VIII; Corelli - Sonata IX; Gabrielli - Canzone e Sonate,Map Earl V. Moore Building - Blanche Anderson Moore Hall,['2010-02-13 20:00']
146,Snowshowing and Crosscountry Skiing Day Trip,"Explore all that Michigan winter's have to offer. Get outside and enjoy the winter wonderland while learning to cross-country ski or embellish your skills, practice some snow shoeing, enjoy a warm cup of hot chocolate, and get a chance to return to your childhood making a snowman! Join Outdoor Adventure for a day trip to get outside and enjoy the fresh air and snow covered area. You'll return to Ann Arbor refreshed with a new group of adventure-seekers.",,['2010-01-23 8:00']
147,Parenting through Separation & Divorce,"All parents are concerned about the well-being of their children as they face the challenges of separation and divorce. This workshop helps parents understand their children's needs at this time, and offers specific suggestions for creating the most beneficial post-divorce parenting relationships. This presentation is an approved alternative to the SMILE program presented by the Friend of The Court. Registration is required; please call us at (734) 764-9466 to reserve a space.",Map East Hall - 1465,['2009-10-05 19:30']
148,Panhel Social Meeting,Mandatory meeting for Presidents and Social Chairs,Map Michigan Union - Anderson,['2010-09-01 18:00']
149,"""Trafficking, Prostitution, and Inequality""","Speaker: Catharine A. MacKinnon, Elizabeth A. Long Professor of Law, University of Michigan Law School The International Law Workshop introduces today's most debated issues in international and comparative law. Speakers will talk for 25 minutes, followed by discussion and questions.",Map Hutchins Hall - 218,['2010-03-31 12:15']
150,NPHC 2010 Step Show: It's All Fun & Games,Step Showcase of 9 historically African American Fraternities and Sororities.,,['2010-04-20 19:30']
151,Jer Coons,"Jer Coons is a singer-songwriter from the Green Mountains of Vermont. He's 20 years old, and, he says, he does not shop at Urban Outfitters trying to buy trendy things in an attempt to look ten years younger, because then he would look like a ten-year-old. This kid can write a pop song! Armed with drop-dead catchy melodies, boyish good looks, and, he claims, a charm equal to or greater than Paris Hilton, Jer is poised for national recognition. His songs draw comparisons to John Mayer, Jason Mraz, and Damien Rice (although, Jer says, you do not need Zoloft to enjoy his music). His debut album, ""Speak,"" has just appeared, and you may have heard his song ""Legs"" playing at the Hollister store at Briarwood or in others all across North America.",,['2009-10-12 20:00']
152,"Stride With Asha, 5k charity run/walk","Asha for Education is a non-profit organization that aims to catalyze a socio-economic change in India through the education of underprivileged children. Asha for Education - Ann Arbor chapter is proud to introduce 'StrideWith Asha', a 5k charity run/walk. Come and spend a Saturday morning with family and friends, enjoy the breeze, and help a child's education. What: Stride With Asha, 5k charity run/walk (run/walk at your own pace!) When: Saturday, September 26th, at 9:00 am Where: Gallup Park, Ann Arbor Registration fee: $20-general, $15-Students More information and registration at: www.ashanet.org/annarbor/stridewithasha Please forward this e-mail to your friends and help spread the word. It would be great if you can get your friends and family to take part in our event too! ""THE FIRST 50 REGISTRANTS WILL RECEIVE A FREE T-SHIRT""- so hurry up!!",,['2009-09-26 9:00']
154,"Masters Recital:  Willis Bote, tenor","PROGRAM: Set 1: Beethoven - Adelaide No. 3, Op. 12; Wonne der Wehmut No. 1, Op. 83;Der KuÃŸ Op. 128; Set 2: Ravel - Chanson de la mariée; LÃ -bas, vers l'église; Quel gallant m'est comparable; Chanson des cueilleuses de lentisques; Tout gai!; Set 3: Mozart - Misero! O sogno, o son desto? KV 431; Set 4: Rachmaninov - >:0;87 No. 14, Op. 34; C>= No. 5, Op. 8; 5 ?>9, :@0A028F0 No. 4, Op. 4; 45AL E>@>H> No. 7, Op. 21; Set 5: Botti - Jabberwocky",Map Earl V. Moore Building - Britton Recital Hall,['2010-03-15 20:00']
